filename,item_title,item_subtitle,item_image,item_url,url_main,item_summary,type,hierarchy1,content
spokengospel_2 Kings 21-23_text,2 Kings 21-23,"Josiah, the Last Good King",https://cdn.prod.website-files.com/63ec12d1cd984b7ed1155746/6402933e4b57269e986b4bf4_book-hero-ph.webp,https://www.spokengospel.com/devotionals/2-kings-21-23#read,,"In 2 Kings 21-23, we see that a faithful king can only save if he's on the throne. And unlike Josiah, who rose from his throne to die, Jesus rose from the dead to rule forever.",Website,1 & 2 Kings Bible Study,"What’s Happening?

Manasseh replaces Hezekiah as Judah’s king, and he’s the worst. He rebuilds the shrines Hezekiah tore down, erects altars to Baal and Asherah inside God’s temple, burns his son on their altars, consults with necromancers, murders the innocent, and reverts Israel to a state worse than when they first entered the land (2 Kings 21:9, 11). Fittingly, Manasseh’s name means “forgetful.” Israel has forgotten the God who saved them—and everything God saved them to be. So God “forgets” his previous grace and determines to exile Judah and end His relationship with her (2 Kings 21:14).

But Manasseh’s grandson Josiah is nothing like his grandfather (2 Kings 22:2). He is the only man in Scripture said to fulfill God’s law with his whole heart, soul, and might (2 Kings. 23:25). He repairs the temple that his grandfather desolated (2 Kings 22:5). And when he discovers a lost copy of God’s Word, he realizes the extent of Judah’s sins and grieves (2 Kings 22:11). Beginning with the temple, Josiah undoes the idolatry of Judah and Israel’s past. He dismantles the golden calves Jeroboam used to divide the kingdom, and burns the bones of the false prophets and priests who facilitated the cult (2 Kings 23:15-16). The only bones he leaves undisturbed belong to the unnamed prophet who predicted his reign (1 Kings 13:2, 2 Kings 23:17). And then, for the first time since Joshua reigned, Israel celebrates the Passover (2 Kings 23:22). Israel has never had a king like Josiah.

But it’s not enough (2 Kings 23:26). Unprecedented obedience by one king does not undo the atrocities of another, let alone centuries of violence and harm caused by Judah’s forgetfulness (2 Kings 23:27). Josiah is unceremoniously killed in battle against Egypt. His son is crowned but three months later deposed (2 Kings 23:33). And Egypt installs a puppet-king who’s willing to extort his own people to pay the costs of another kingdom (2 Kings 23:35).

Where is the Gospel?

Josiah shows us that obedience to God’s law cannot reverse generations of forgetfulness and idolatry. God’s law is impotent to save God’s people from her prophesied destruction. The apostle Paul says that the law confined people to disobedience to make them hope for a Final Savior (Galatians 3:22). God’s law couldn’t save, but it could teach Israel what they truly needed. God’s people would not be saved by Josiah’s obedience to the law, but by faith in King Jesus (Galatians 3:24).  

Josiah’s obedience delayed Judah’s destruction, but that abatement only lasted as long as he lived. A faithful king can only save if he’s on the throne. But unlike Josiah, who rose from his throne to die, Jesus rose from the dead to rule (Romans 8:34). When we trust Jesus, we are trusting a King who can never die. And so the destruction of God’s people is eternally delayed! There is never an exile for those in King Jesus (Romans 8:1).

God has not forgotten his people. Rather, in Jesus, he forgets our forgetfulness (Hebrews 8:12). God remembers our sins no more. And right now, he is making us into a people unable to forget his grace and law (Hebrews 8:10-11). If you are a Manasseh, he wants to make you a Josiah (2 Corinthians 5:17). He promises to fill you with himself, allowing you to love God with all your heart, soul, mind, strength.

See for Yourself

May the Holy Spirit open your eyes to the God who judges our forgetfulness. And may you see Jesus as our unforgetful King who nevertheless remembers our sins no more."
spokengospel_2 Kings 21-23_video,2 Kings 21-23,"Josiah, the Last Good King",https://cdn.prod.website-files.com/63ec12d1cd984b7ed1155746/6402933e4b57269e986b4bf4_book-hero-ph.webp,https://www.youtube.com/watch?v=868x1eEcP9U,https://www.spokengospel.com/devotionals/2-kings-21-23#read,"In 2 Kings 21-23, we see that a faithful king can only save if he's on the throne. And unlike Josiah, who rose from his throne to die, Jesus rose from the dead to rule forever.",video,1 & 2 Kings Bible Study,
spokengospel_2 Kings 18-20_text,2 Kings 18-20,King Hezekiah,https://cdn.prod.website-files.com/63ec12d1cd984b7ed1155746/6402933e4b57269e986b4bf4_book-hero-ph.webp,https://www.spokengospel.com/devotionals/2-kings-18-20#read,,"In 2 Kings 18-20, we see that even when people like us are divided, Jesus is not. Jesus is wholeheartedly committed to the rescue of his people.",Website,1 & 2 Kings Bible Study,"What’s Happening?

Hezekiah takes the throne in Judah, but his allegiances are divided (2 Kings 18:1). He’s the first king in centuries to tear down the shrines that dot Judah’s landscape (2 Kings 18:4). But in six years Assyria will overthrow Israel and test Hezekiah’s faith in the process. Assyria’s king, Sennacherib, is a gifted tactician who levels several Judean fortified cities (2 Kings 18:13). But instead of trusting God, Hezekiah raids God’s temple of its silver and gold to pay off the ruthless king (2 Kings 18:15-16). Hezekiah’s allegiance is divided and Sennacherib takes advantage. He sends a delegation of counselors to force a surrender to Assyria and her gods (2 Kings 18:17). Cleverly, the Assyrian delegate makes sure to sound like an Israelite prophet. He tells Hezekiah not to trust in Egypt or her horses. He promises a land flowing with milk and honey (2 Kings 18:24, 32). With God’s gold in their pockets they pridefully assume God’s place and hope to demoralize Hezekiah in the process.  

Distressed, Hezekiah returns to the temple. But this time it is not to rob it, but to pray (2 Kings 19:1, 14). Despite Hezekiah’s divided allegiances, God responds through the prophet Isaiah and promises that Israel will rise from its ashes in three years (2 Kings 19:28, 29). That same night 185,000 Assyrian soldiers die by God’s hand (2 Kings 19:35). But before Hezekiah can experience Israel’s renewal, he’s struck by a life-threatening illness (2 Kings 20:1). And unlike previous kings on their deathbed, he prays to God—and God promises to heal him in three days and extend his life by 15 years (2 Kings 20:5-6).

But true to his half-heartedness, these gifted years are used foolishly. Presumably to secure an alliance against Assyria, Hezekiah invites delegates from Babylon to tour Israel’s wealth (2 Kings 20:13). Isaiah calls out Hezekiah’s divided allegiances for what they are and announces that the nation he’s courting will plunder everything he’s shown them (2 Kings 20:17-18). 

Where is the Gospel?

Judah will fall into Babylon’s hands because they fail to trust God alone. And Hezekiah, as Judah’s king, embodied his nation’s divided allegiances. Jesus says we cannot serve two masters (Matthew 6:24). Hezekiah proves divided allegiances ultimately lead to death and exile.

Part of the message of Hezekiah is, “Don’t be like him!” Dividing your trust divides your rescue. You can not be half-saved. You are either dead or alive. Rescued or captive. At home or exiled. And God wants your undivided allegiance so that he can give you undivided and eternal life. Hezekiah tried to save his life by robbing the temple, but what he needed was a willingness to lose his life out of undivided loyalty to his God. It did Hezekiah no good to gain peace from his enemies because he lost his soul in the process (Matthew 16:25-26). Jesus promises to reward those willing to lose their lives with complete rescue and resurrection. Don’t be like Hezekiah!

But even more significant is that Hezekiah was spared because of promises God made to King David (2 Kings 19:34). Even when Hezekiah is divided, God is not. He was still wholeheartedly committed to the rescue of his people, despite centuries of unfaithfulness and Hezekiah’s own divided heart. Ultimately, salvation from enemies and of nations relies on God’s indivisible grace alone.

Sennacherib’s propaganda is wrong. No nation or idol can save. The only hope of Israel was and is God alone. Jesus has done battle with greater enemies than Assyria and rose from the dead three days later (1 Corinthians 15:4). Only the God of Israel revives on the third day! Jesus offers resurrection and life—even to the divided. Salvation comes from God alone and by grace alone. 

See for Yourself

May the Holy Spirit open your eyes to see the God of life. And may you see Jesus as the King who is worthy of your undivided allegiance."
spokengospel_2 Kings 18-20_video,2 Kings 18-20,King Hezekiah,https://cdn.prod.website-files.com/63ec12d1cd984b7ed1155746/6402933e4b57269e986b4bf4_book-hero-ph.webp,https://www.youtube.com/watch?v=ctb4oidSuXI,https://www.spokengospel.com/devotionals/2-kings-18-20#read,"In 2 Kings 18-20, we see that even when people like us are divided, Jesus is not. Jesus is wholeheartedly committed to the rescue of his people.",video,1 & 2 Kings Bible Study,
spokengospel_1 Kings 3-5_text,1 Kings 3-5,Solomon Asks for Wisdom,https://cdn.prod.website-files.com/63ec12d1cd984b7ed1155746/6402933e4b57269e986b4bf4_book-hero-ph.webp,https://www.spokengospel.com/devotionals/1-kings-3-5#read,,"In 1 Kings 3-5, we see that in a world after Eden, only a wise King can bring us the blessing God promised Abraham and the peace and provision Adam and Eve knew. That wise King is Jesus.",Website,1 & 2 Kings Bible Study,"What’s Happening?

David’s son Solomon has taken the throne. Immediately we’re told that Solomon loves the Lord (1 Kings 3:3a). And the Lord loves Solomon as well. As Solomon sacrifices 1,000 burnt offerings, God comes to him in a dream and says he will answer any request (1 Kings 3:5). Recognizing his own inexperience and immaturity, Solomon asks for wisdom and the ability to know the difference between good and evil (1 Kings 3:9).

God is thrilled with this request (1 Kings 3:10). He not only gives Solomon an unparalleled mind but everything he didn’t ask for—riches, honor, and a long life—provided he remains faithful to God’s law (1 Kings 3:12-14).

As soon as Solomon wakes from his dream, God’s wisdom is put to the test. A custody battle between two prostitutes is brought into Solomon’s court (1 Kings 3:16). Quickly Solomon realizes this case is just one woman’s word against another’s (1 Kings 3:23). He can never prove who is telling the truth based on their testimony. So, he threatens to cut the baby in two knowing that the real mother would never allow this to happen (1 Kings 3:27). In that moment, it’s apparent that God has granted Solomon’s request for wisdom. He’s wisely able to determine good from evil and bring justice to bear (1 Kings 3:28).

The kingdom seems to explode in response. Israel is “as numerous as the sand on the seashore” (1 Kings 4:20). That wording is taken from God’s promise to Abraham, and it’s the first time it is used as a description of Israel. That same phrase is also repeated to describe Solomon’s breadth of mind (1 Kings 4:29-30). God gives Solomon wisdom broad enough to rule the growing kingdom.  

Drawing on imagery from creation, Solomon’s wisdom is described seven times. He understands the beasts, birds, and trees (1 Kings 4:33). He has “dominion” over Israel like Adam did over Eden (1 Kings 4:24). And every family rests in peace under their own fig trees and grape vines (1 Kings 4:25). All the nations of the world come to be blessed by his wisdom (1 Kings 4:34). And Solomon makes plans to finally build God’s temple on the earth (1 Kings 5:5). Just as in the garden, man and God will walk together again! 

Where is the Gospel?

When Solomon asks for wisdom to know both good and evil, it's a reference to the garden of Eden. Adam was told not to eat from the tree of the knowledge of good and evil (Genesis 2:16). Since everything was “good” in the garden, there was no reason to know “evil.” But since Solomon lived in a world where not everything was good, and the line between good and evil was often blurred, he needed to know both. And once he did, Eden seemed to return. 

In a world after Eden only a wise King can bring us the blessing God promised Abraham and the peace and provision Adam and Eve knew. Like the wronged woman, we need a King who can see good and evil clearly and provide wise justice; not just when we’ve been wronged but when we don’t know what’s right. 

That wise King is Jesus. Like Solomon asked for wisdom and was given wealth and power, and like the woman asked for justice and was given a son, we look for wisdom in Jesus. Then we’re given a place in his eternal Kingdom and all the blessing and peace that comes with it (Matthew 6:33). And while we wait for Jesus’ Kingdom to come, our Bible contains the wisdom we need to know and do good works in an evil world (2 Timothy 3:16).

Jesus wants to rule wisely in our favor. So like both the wronged woman and Solomon, humble yourself before the wisdom of King Jesus and receive the justice and peace of a New Creation. 

See For Yourself

May the Holy Spirit open your eyes to see the God who is wise. And may you see Jesus as God’s wise King who establishes a Kingdom of peace on the earth."
spokengospel_1 Kings 3-5_video,1 Kings 3-5,Solomon Asks for Wisdom,https://cdn.prod.website-files.com/63ec12d1cd984b7ed1155746/6402933e4b57269e986b4bf4_book-hero-ph.webp,https://www.youtube.com/watch?v=CqWlb-xWblM,https://www.spokengospel.com/devotionals/1-kings-3-5#read,"In 1 Kings 3-5, we see that in a world after Eden, only a wise King can bring us the blessing God promised Abraham and the peace and provision Adam and Eve knew. That wise King is Jesus.",video,1 & 2 Kings Bible Study,
spokengospel_2 Kings 14-17_text,2 Kings 14-17,Israel Dies,https://cdn.prod.website-files.com/63ec12d1cd984b7ed1155746/6402933e4b57269e986b4bf4_book-hero-ph.webp,https://www.spokengospel.com/devotionals/2-kings-14-17#read,,"In 2 Kings 14-17, we see that Jesus is the true Israelite King who will bring his people back from the dead.",Website,1 & 2 Kings Bible Study,"What’s Happening?

Israel and Judah’s persistent idolatry is pushing God’s people towards inevitable spiritual, physical, and national death by Assyria’s hands.

In Israel, Jeroboam II is murdered by Zechariah, who six months later is assassinated by Shallum. One month later, Shallum is killed by Menahem. In an attempt to stabilize power and assuage Assyria’s landlust, Menahem levies extreme taxes from his people (2 Kings 15:20). This means that when his son inherits the kingdom, it’s drained of its wealth, and vulnerable to Pekah, the mutinous captain of his military (2 Kings 15:25). Pekah steals the throne but loses several strategic cities and tribal lands to the hungry Assyrians (2 Kings 15:29). Pekah’s failures lead Hoshea, Israel’s final king, to conspire and kill him (2 Kings 15:30). Still under pressure from Assyria, Hoshea tries to secure an alliance with Egypt. But it backfires (2 Kings 17:4). Assyria discovers the treachery, imprisons Hoshea, invades Israel, and carries the Israelites into exile (2 Kings 17:6). Hoshea means “salvation,” but Israel is damned under Hoshea’s idolatrous rule. 

During this same period of time Judah is only slightly better off. We’re told Amaziah, his son, and his grandson do right in God’s eyes, although not like their forefather David (2 Kings 14:3). All three of them tolerate similar idolatries and each pays a price for it (2 Kings 15:4, 35). Amaziah is assassinated, his son is leprous, and his grandson is plagued by conflict with Syria and Israel (2 Kings 14:19, 15:5, 37). When Amaziah’s next descendant Ahaz takes Judah’s throne, he’s the first king in decades to do evil in God’s eyes, and the first king in Judah’s history to sacrifice his son to a pagan god (2 Kings 16:2-3). Judah is on the same idolatrous death-march as Israel. 

Ahaz even strips God’s temple of its silver and gold to pay Assyrian mercenaries to attack Syria and Israel (2 Kings 16:7-8). Then, in symbolic deference to Assyria and her gods, Ahaz rapes the temple further and replaces the altar God designed with a copy of the Assyrian one (2 Kings 16:10-11, 17-18).

The record of this period of Israel’s history ends with an interpretation. Assyria carried off Israel because both Israel and Judah failed to fear, worship, and love God alone (2 Kings 17:7-8). On Mount Sinai God gave Israel ten commandments—and ten violations of those commandments are listed here. Israel has entirely turned away from the God of life. They prefer the idols of other nations, and so God leaves Israel to their spiritual, physical, and national death (2 Kings 17:22-23). 

Where is the Gospel?

In one sense Israel and Judah’s deaths were self-inflicted, but death is also God’s judgment. It wasn't a coincidence that the man named “salvation” is the one who destroyed Israel. It was God’s irony proving disobedience always brings death (Romans 6:23).  

But while both Israel and Judah are dead in their sins, God is rich in mercy and love towards his people. Earlier in Kings when a corpse was thrown into faithful Elisha’s grave, the Israelite man raised from the dead (2 Kings 13:21). And by the death of God’s faithful son Jesus, he will make his people alive once again (Ephesians 1:4-5).

If the story has always been disobedience leads to death, what happens when obedience leads to death like it did for Jesus (Philippians 2:8)? Just as it was hinted at with Elisha, the apostle Paul says that when the finally faithful Israelite King dies, he’s raised from the dead (Philippians 2:9). And at the name of Jesus (whose name, like Hoseha, also means salvation) every knee will bow to the true King of life, death, and the world (Philippians 2:10). 

There is no idol that brings life from the dead. There is no obedience to another god’s laws that will end our spiritual, physical, and national death. But when we bow—or better yet throw—ourselves into the tomb of King Jesus, we will rise (Romans 6:4). 

See for Yourself

May the Holy Spirit open your eyes to see the God who brings life from the dead. And may you see Jesus as the King whose name means salvation."
spokengospel_2 Kings 14-17_video,2 Kings 14-17,Israel Dies,https://cdn.prod.website-files.com/63ec12d1cd984b7ed1155746/6402933e4b57269e986b4bf4_book-hero-ph.webp,https://www.youtube.com/watch?v=5MachN_niJA,https://www.spokengospel.com/devotionals/2-kings-14-17#read,"In 2 Kings 14-17, we see that Jesus is the true Israelite King who will bring his people back from the dead.",video,1 & 2 Kings Bible Study,
spokengospel_1 Kings 11_text,1 Kings 11,Solomon's 700 Wives,https://cdn.prod.website-files.com/63ec12d1cd984b7ed1155746/6402933e4b57269e986b4bf4_book-hero-ph.webp,https://www.spokengospel.com/devotionals/1-kings-11#read,,"In 1 Kings 11, we see that even though this son of David failed to establish an eternal kingdom for Israel, Jesus does not.",Website,1 & 2 Kings Bible Study,"What’s Happening?

God has appeared to Solomon twice so far, and each time God gives the same warning (1 Kings 3:14, 9:4-5). If Solomon walks in the Lord’s ways, like his father David, God will continue to grow and establish his kingdom. And so far, Solomon’s reign has been glorious. Israel is at the height of its cultural and military dominance. Solomon seems to be like his father, and Israel has thrived as a result. 

But Solomon is not like his father (1 Kings 11:6). Solomon has collected 700 wives and 300 concubines (1 Kings 11:3). Some could argue (not that you should) that a harem like this is just wise statecraft. These women represent political alliances and Solomon’s shrewd consolidation of Mespotamian power. But however wise politically, God had already warned how foolish this is spiritually (1 Kings 11:2). In his old age Solomon ends up prostituting himself before the abominable gods of the nations around him (1 Kings 11:7). So God keeps his promise, withdraws his blessing and tells Solomon the kingdom will be stripped from his family’s hand and given to someone else (1 Kings 11:11). 

We’re then given the origin stories of three new enemies—Hadad from Edom, Rezon a Gentile, and Jeroboam an Israelite. They will plague Solomon’s later years and one day overthrow his son. Jeroboam represents the most serious threat. He already has significant power in Solomon’s kingdom (1 Kings 11:28). And one of God’s prophets, Ahijah, prophesies that he will be the one to rip ten tribes from under Solomon’s son’s rule (1 Kings 11:31). 

God even gives the same promise to Jeroboam that he gave to Solomon. If Jeroboam obeys God, like David did, his nation will be as great as his grandfather’s (1 Kings 11:38). So Solomon tries to assassinate him but fails. Jeroboam seeks asylum in Egypt (1 Kings 11:40). Solomon then dies, having failed not only to walk in God’s commands but also to to stop the prophesied end of his family’s dynasty and the beginning of a civil war (1 Kings 11:43).

Where is the Gospel?

Solomon’s life and death foreshadow both the rest of the book of Kings and the rest of Israel’s history. The foreign enemies God raises against Solomon are the forefathers of the nations of Assyria and Babylon. And Jeroboam's rebellion will divide Israel for the rest of her history. Even Jesus is opposed by the same three nations mentioned here. Herod is an Edomite, the Romans are Gentiles, and the scribes and Pharisees are Jewish. Solomon’s failures have set the pattern that Israel is doomed to repeat.

The rest of the book of Kings tells story after story of Israel marrying forbidden spouses, worshipping idols that are abominations, and dividing further from one another and from the Lord. So God keeps his promise to Solomon. He withdraws his blessing, strips Israel’s kingdom bare, and hands them over to Assyria (1 Kings 11:11). 

But because of David’s faithfulness to God, God promised David that one of his sons would rule forever (2 Samuel 7:12). That promise hasn’t been overturned; it’s why both Solomon and his son are told to act like David (1 Kings 11:6, 38). Israel’s fate hangs on the promise of a son of David who is even greater than his father. But that son is not Solomon, it’s Jesus. 

Unlike Solomon, Jesus followed the example of his father (John 5:19). Unlike Solomon, Jesus doesn’t use his wisdom to consolidate power but to give his power away (1 Corinthians 1:23-24). So unlike Solomon’s death that sealed the division of his kingdom and the death of his dynasty, Jesus’ death inaugurated an eternal Kingdom and a united family of God. 

Jesus is the King we’ve been waiting for. We don’t need to be afraid. Our kingdom isn’t on the verge of collapse; we have a citizenship in heaven that can’t be undone by politics (Philippians 3:20). Our nation is secure and the enemies that once threatened us, like Edom and the Gentiles once threatened Israel, can now be counted as brothers and sisters by the power of Jesus’ rule (Ephesians 2:11-12). 

See for Yourself

May the Holy Spirit open your eyes to see God as our only true King. And may you see Jesus as the final Son of David whose Kingdom lasts forever and who makes our enemies into our family."
spokengospel_1 Kings 11_video,1 Kings 11,Solomon's 700 Wives,https://cdn.prod.website-files.com/63ec12d1cd984b7ed1155746/6402933e4b57269e986b4bf4_book-hero-ph.webp,https://www.youtube.com/watch?v=fzEAyJI5GCw,https://www.spokengospel.com/devotionals/1-kings-11#read,"In 1 Kings 11, we see that even though this son of David failed to establish an eternal kingdom for Israel, Jesus does not.",video,1 & 2 Kings Bible Study,
