filename,item_title,item_subtitle,item_image,item_url,url_main,item_summary,type,hierarchy1,content
spokengospel_2 Kings 1-2_text,2 Kings 1-2,Elisha Succeeds Elijah,https://cdn.prod.website-files.com/63ec12d1cd984b7ed1155746/6402933e4b57269e986b4bf4_book-hero-ph.webp,https://www.spokengospel.com/devotionals/2-kings-1-2#read,,"In 2 Kings 1-2, we see that when Jesus, like Elijah, ascended to heaven, the mantle of his authority was passed on to his disciples—us.",Website,1 & 2 Kings Bible Study,"What’s Happening?

Ahab’s evil line is coming to an end, but so is the prophet Elijah’s ministry (2 Kings 2:1) 

Ahab’s son Ahaziah is badly wounded and sends a messenger to ask Baal-Zebub, the god of Ekron if he’ll recover (2 Kings 1:2). But God sends Elijah to intercept Ahaziah’s men (2 Kings 1:3). Wearing nothing but a cloak made of hair and a leather belt, he tells them that Ahaziah will die for his failure to inquire of the God who lives in Israel (2 Kings 1:6, 8).

Enraged, Ahaziah sends two troops of 50 men to capture Elijah (2 Kings 1:9). Each cries out, “Man of God...Come down” (2 Kings 1:9b). The Hebrew word for “man” is very similar to the Hebrew for “fire.” So Elijah says that in response to their threats and disbelief, the fire of God will come down—and it does on the first two troops of Ahaziah’s men (2 Kings 1:10). But a third battalion asks for mercy and is spared (2 Kings 1:13). Ahaziah dies shortly after knowing mercy was only an ask away (2 Kings 1:17). 

Soon Elijah will die and leave Elisha to continue his prophetic opposition against Ahab and Israel’s idolatry (1 Kings 19:19). Together they travel from Bethel to Gilgal and then to Jericho; each a significant location in Joshua’s succession of Moses. And in each, Elijah offers Elisha the opportunity to refuse his prophetic mantle, but he won’t (2 Kings 2:6). 

Groups of false prophets try to taunt Elisha away from this calling by jeering that Elisha will have no “head” or leader to protect him (2 Kings 2:3, 5). As a threat, they gather in a troop of 50 by the Jordan River (2 Kings 2:7). Meanwhile, like Moses and Joshua, Elijah parts the waters of the Jordan with his cloak. And Elisha asks God for a doubling of Elijah’s anointing (2 Kings 2:8-9). Immediately, Elijah is caught in a whirlwind and ascends to heaven, leaving his cloak (2 Kings 2:11). Elisha wears it as Elijah’s successor and asks the taunting prophets, “Where now is the Lord?” The implied answer is in Israel and with Elisha.

Elisha proves this by parting the Jordan himself (2 Kings 2:14). Unlike Joshua, who parted the river and destroyed Jericho, Elisha heals the enemy city (2 Kings 2:21). And when a new group of young men taunts Elisha for having no “hair” on his “head” (which is an innuendo about how Elijah and his “hairy” robe was used to protect Elisha), bears come out of the woods to maul them (2 Kings 2:24). Like fire fell from the sky to vindicate Elijah, God proves Elisha is Elijah’s successor and is protected by Israel’s God himself. 

Where is the Gospel?

This is one of many stories of succession in Scripture where the next generation is greater than the first. Moses led Israel to the borders of their promised land, but Joshua conquered and settled it. Elijah performed powerful miracles, but Elisha has twice his anointing and will do almost double his miracles (2 Kings 2:9). Again, at the Jordan River, John the Baptist said of Jesus, his successor, “he must become greater; I must become less” (John 3:30). And Jesus’s ministry didn’t just wash people as a sign of repentance but bathed them with God’s Spirit (Matthew 3:11).

You and I are also successors. When Jesus, like Elijah, ascended to heaven, the mantle of his authority was passed on to his disciples (Acts 1:8-9). And like Joshua and Elisha, by his Spirit, we will do greater things than our predecessor Jesus (John 14:12). His anointing is not doubled but tripled, quadrupled, and billion-dupled with every believer on the planet. And while Joshua and Elisha got a taste of God’s Spirit, we are filled by God’s Spirit (John 14:20).

God has not left us alongside unconquered borders, among jeering rulers, and in an evil world without a dose of his anointing. Just as Joshua, Elijah, and Jesus all passed through the waters of the Jordan and saw God was in Israel with them, we will pass through the waters of baptism and will know God is with us wherever we are. This is not because we ascend to heaven or because bears maul our enemies or doves rest on our shoulders (Matthew 3:16), but because the tomb is empty. 

With Elisha, we can stand in Israel over Jesus’ empty grave and ask a taunting world, “Where now is the Lord?” Knowing that Jesus has mauled death like a bear, and his Spirit has fallen like fire on us. 

So, as new Joshuas and Elishas, we go into a hostile world unafraid. Our predecessor has overcome the world, and his help is only an inquiry away. 

See for Yourself

May the Holy Spirit open your eyes to see the God of Israel who is with his people. And may you see Jesus as your predecessor, who has filled you with His Spirit to overcome the world."
spokengospel_2 Kings 1-2_video,2 Kings 1-2,Elisha Succeeds Elijah,https://cdn.prod.website-files.com/63ec12d1cd984b7ed1155746/6402933e4b57269e986b4bf4_book-hero-ph.webp,https://www.youtube.com/watch?v=zFPVvMZz0oI,https://www.spokengospel.com/devotionals/2-kings-1-2#read,"In 2 Kings 1-2, we see that when Jesus, like Elijah, ascended to heaven, the mantle of his authority was passed on to his disciples—us.",video,1 & 2 Kings Bible Study,
spokengospel_2 Kings 4_text,2 Kings 4,Elisha Raises the Dead,https://cdn.prod.website-files.com/63ec12d1cd984b7ed1155746/6402933e4b57269e986b4bf4_book-hero-ph.webp,https://www.spokengospel.com/devotionals/2-kings-4#read,,"In 2 Kings 4, we see that Jesus is better than Elisha. He, too, brings life wherever he goes, even when he goes to the grave.",Website,1 & 2 Kings Bible Study,"What’s Happening?

Israel is dying. In a visceral picture of the idolatry and failure of Israel’s leaders, a famine has starved the land (2 Kings 4:38). And a widow, unable to find justice from her king, goes to Elisha for help (2 Kings 4:2a). Debt collectors will soon force her sons into slavery unless the debt is paid (2 Kings 4:2b). Elisha tells her to borrow jars from her neighbors, take the little oil she has left, and pour it into the empty jars (2 Kings 4:4). Miraculously every empty vat in the village is filled with the oil in her small bottle (2 Kings 4:6). The widow is left with more than enough to pay off her debts and survive the famine (2 Kings 4:7). Israel is dying, but Elisha brings life to a home left for dead. 

A wealthy woman from the town of Shunem understands that Elisha’s ministry is unique (2 Kings 4:9). She builds him a room on the roof of her house and places a table, a chair, and a menorah (or a lamp) inside it (2 Kings 4:10). These are the same decorations used in the temple. They’re a sign that this Shunammite woman knows that God’s life-giving presence abides with Elisha. And in response to her generosity, Elisha prophesies that her dead womb will give birth to a son—and it does (2 Kings 4:17).

For years the family lives happily until the son tragically dies (2 Kings 4:20). She places his body in the rooftop temple and strangely doesn’t tell her husband that their son has died (2 Kings 4:21-22). She tells him that “all is well” and quickly sets off to find Elisha on Mt. Carmel (2 Kings 4:23-24a). Elisha’s servant Gehazi sees her from a distance and asks what’s wrong, only to get the same answer she gave to her husband: “All is well” (2 Kings 4:26). She only reveals her need to the man of God (2 Kings 4:28). She knows only God’s man can bring life. 

Elisha sends young Gehazi ahead with his staff to lay on the boy, but nothing happens (2 Kings 4:29). It’s only when God’s mobile temple—Elisha—touches the boy that he comes back to life (2 Kings 4:34). In Elisha, death does not take life, but life takes death.

We see this theme again as Elisha camps overnight in Gilgal. He and his men make a stew from wild gourds only to realize they’re poisonous (2 Kings 4:40). But the man of God takes the death out of the pot (2 Kings 4:41). And when his 100 men are hungry again, Elisha multiplies loaves of barley and grain, with leftovers to spare (2 Kings 4:44). 

Where is the Gospel?

Elisha was a walking, talking temple when Israel's temple was in shambles, and its leaders were corrupt. He brings life and relief wherever he goes because God is with him. In this way, Elisha’s ministry prepares us for Jesus. 

Jesus lived in a time when Israel's temple and leaders had become corrupt. Jesus knows he is a walking, talking temple. Like Elisha, Jesus multiplies food and raises the dead. He also heals the sick and cleanses lepers. Wherever he went life followed, and death was pushed back. Jesus was God’s life-giving presence in the flesh (John 1:14). He was the God-Man who could bring life. 

But more significantly than resuscitating a widow’s son who would one day die again, Jesus has risen from the dead never to die again. Like the Shunammite woman, we do not need to bring our death to anyone but Jesus. Because he lives forever, we know he will bring life-giving relief to any who ask for his presence. 

See for Yourself

May the Holy Spirit open your eyes to see the God of Life. And may you see Jesus as the one who gives that life, even to the dead."
spokengospel_2 Kings 4_video,2 Kings 4,Elisha Raises the Dead,https://cdn.prod.website-files.com/63ec12d1cd984b7ed1155746/6402933e4b57269e986b4bf4_book-hero-ph.webp,https://www.youtube.com/watch?v=qBFiWQrkqgE,https://www.spokengospel.com/devotionals/2-kings-4#read,"In 2 Kings 4, we see that Jesus is better than Elisha. He, too, brings life wherever he goes, even when he goes to the grave.",video,1 & 2 Kings Bible Study,
spokengospel_1 Kings 1_text,1 Kings 1,The Last Days of King David,https://cdn.prod.website-files.com/63ec12d1cd984b7ed1155746/6402933e4b57269e986b4bf4_book-hero-ph.webp,https://www.spokengospel.com/devotionals/1-kings-1#read,,"In 1 Kings 1, we see that David's last days as king and Solomon's first are less about a transition from one regime to another but about the coronation of David's final son, Jesus.",Website,1 & 2 Kings Bible Study,"What’s Happening?

The book of Kings tells us more about God than it  tells us about Israel's history. God promised David an eternal dynasty and a kingdom that would not be undone by death or rebellion (2 Samuel 7:13). But David is on his deathbed and his kingdom is in crisis (1 Kings 1:1; 2:10). God’s promise of an eternal throne is at risk. Will God continue to be a God of life, even in death?

 David’s second-born son, Adonijah, revolts against David’s third-born son, Solomon (1 Kings 1:5). Adonijah is the heir apparent, but David had promised Solomon the throne (1 Kings 1:17). To legitimize his takeover Adonijah turns his father’s trusted general and priest to his side and invites his other royal brothers to a secret coronation (1 Kings 1:7, 9). But Solomon’s mother persuades David to force Solomon’s coronation early (1 Kings 1:11). David gives Solomon his royal donkey and crowns him king in Jerusalem. Solomon is anointed with oil by a priest loyal to the royal family (1 Kings 1:39). Adonijah is in the middle of his feast when he learns his coup has already failed (1 Kings 1:45-46). God’s promises won’t be undone by Adonijah, but will continue through Solomon. 

Fearing for his life, Adonijah rushes to the altar where priests offer sacrifices (1 Kings 1:50). In the book of Numbers, the altar was a place of asylum for people guilty of manslaughter (Numbers 35:25). Adonijah hopes Solomon will apply this law to his treason, and he does. Solomon’s first act as king is one of mercy. He forgives Adonijah’s treason and extends life to a traitor who deserves death (1 Kings 1:53). 

Where is the Gospel?

God brings life from the dead. David’s encroaching death, and Adonijah’s rebellion will not overthrow God’s plans for an eternal Davidic kingdom. Solomon’s ascension and Adonjiah’s failed rebellion are not just history but theology. God will bring life from David’s death through his son. And from Adonijah’s rebellion an eternal kingdom will be born.

In this way, David’s last days as king and Solomon’s first are less about a transition from one regime to another but about the coronation of David’s final son, Jesus. 

Jesus is the promised heir of Israel (Matthew 1:1). He’s anointed not with oil but with the Spirit (John 1:32). He rides into Jerusalem on a donkey (Mark 11:7). Like Solomon’s kingdom, Jesus’ Kingdom emerges from treacherous political drama, self-interest, and betrayal. Solomon’s Father, like God the Father, overturns the plots of sinful men to firmly install his Son on the throne (Acts 2:24). And Jesus begins his administration by forgiving his would-be executioners (Luke 23:34). Like Adonijah, anyone can come to Jesus. Both enemies and traitors can cling to his place of sacrifice and death and receive mercy and life. 

See for Yourself

May the Holy Spirit open your eyes to see God as the one who keeps his promises. And may you see Jesus as the King who brings life after death."
